<?xml version="1.0" encoding="UTF-8"?>
<!DOCTYPE esdeveniments SYSTEM "esdeveniments.dtd">
<esdeveniment>
    <esdeveniment>
        <grup></grup>
        <lloc></lloc>
        <data></data>
        <entrada gratuita="no"></entrada>
    </esdeveniment>
    <esdeveniment>
        <grup></grup>
        <lloc></lloc>
        <data></data>
        <entrada gratuita="si"></entrada>
    </esdeveniment>
    <esdeveniment>
    </esdeveniment>
        <grup></grup>
        <lloc></lloc>
        <data></data>
        <entrada gratuita="no"></entrada>
    </esdeveniment>
</esdeveniment>
